{
  "$schema": "../_schema.json",
  "id": "adu-elektrik-elektronik",
  "university": {
    "tr": "Aydın Adnan Menderes Üniversitesi",
    "en": "Aydın Adnan Menderes University",
    "shortCode": "ADÜ"
  },
  "department": {
    "tr": "Elektrik-Elektronik Mühendisliği",
    "en": "Electrical and Electronics Engineering"
  },
  "gradingScale": {
    "A1": { "min": 95, "max": 100, "gpa": 4.0 },
    "A2": { "min": 90, "max": 94,  "gpa": 3.75 },
    "A3": { "min": 85, "max": 89,  "gpa": 3.5 },
    "B1": { "min": 80, "max": 84,  "gpa": 3.25 },
    "B2": { "min": 75, "max": 79,  "gpa": 3.0 },
    "B3": { "min": 70, "max": 74,  "gpa": 2.75 },
    "C1": { "min": 65, "max": 69,  "gpa": 2.5 },
    "C2": { "min": 60, "max": 64,  "gpa": 2.25 },
    "C3": { "min": 55, "max": 59,  "gpa": 2.0 },
    "D1": { "min": 50, "max": 54,  "gpa": 1.75 },
    "F1": { "min": 0,  "max": 49,  "gpa": 0.0 }
  },
  "passingGrade": "C3",
  "conditionalPassingGrade": "D1",
  "examWeights": {
    "midterm": 0.4,
    "final": 0.6
  },
  "metadata": {
    "contributedBy": "@SeferCinar",
    "lastUpdated": "2026-05-21",
    "sourceUrl": "https://idari.adu.edu.tr/db/ogrenciisleri/webfolders/topics/20240807101225-LISANSEITIMYNETMELII-000063626896031471822672.pdf"
  }
}
